<?xml version="1.0" encoding="UTF-8"?>
<md_doc xmlns:xsi="http://www.w3.org/2001/XMLSchema-instance" xsi:noNamespaceSchemaLocation="C:\Users\WEINIA~1\workspace\toscxmlschema\src\XMLSpySchema.xsd">
	<state>
		<dim-def id="version" sel-tag="1.4"/>
		<dim-def id="Release" sel-tag="Trial"/>
	</state>
	public class
	<choice id="version">
		<alt tag="1.4">List</alt>
		<alt tag="5">List&lt;Job&gt;</alt>
	</choice>
	runJob
	<choice id="Release">
		<alt tag="Trial">trialCount</alt>
		<alt tag="Full"/>
	</choice>
	<let var="r">
		<def>j.run</def>
		<let var="i">
			<def>
				<choice id="Release">
					<alt tag="Trial">break</alt>
					<alt tag="Full"/>
			for
			<choice id="version">
						<alt tag="5">
							<ref var="i"/>
						</alt>
						<alt tag="1.4">
			Iter, while &lt;Job, <ref var="r"/>
							<ref var="i"/>&gt;
			</alt>
					</choice>
				</choice>
			</def>
		</let>
	</let>
</md_doc>
